{
  "$schema": "https://json-schema.org/draft/2020-12/schema",
  "$id": "https://toolkit.internal/contracts/pipeline-manifest.schema.json",
  "title": "PipelineManifest",
  "description": "Output of data-pipeline. Records what was generated (modality decision, target-by-target code files, mock data, local idempotency evidence) and at what human-approval readiness level -- NOT the generated code itself, which lives on disk under output_dir. A human review gate sits between validated and any deployment; see references/toolkit-conventions.md #7. data-pipeline is the only skill of the five without a dedicated schema in the original Phase 0 set (data-contract/model-spec/quality-report/validation-report); this schema was added in Phase 2 once it became clear the run-manifest envelope alone can't carry modality/readiness/generated-file bookkeeping without redefining a shared contract every other skill also depends on. See DECISIONS.md.",
  "type": "object",
  "additionalProperties": false,
  "required": [
    "schema_version", "run", "pipeline_id", "source_refs", "modality_decision",
    "targets", "mock_data", "idempotency_check", "readiness_level", "deployment", "assumptions"
  ],
  "properties": {
    "schema_version": { "type": "string", "pattern": "^\\d+\\.\\d+\\.\\d+$" },
    "run": { "$ref": "run-manifest.schema.json" },
    "pipeline_id": {
      "type": "string",
      "description": "Stable identifier across re-runs for the same generated pipeline (e.g. hash of target table names), so a new run's diff can be matched to a previous one."
    },
    "source_refs": {
      "type": "object",
      "description": "What this pipeline was generated from. At least one of data_contract_ref / model_spec_ref must be non-null -- data-pipeline never generates code from nothing.",
      "additionalProperties": false,
      "properties": {
        "data_contract_ref": {
          "type": ["object", "null"],
          "additionalProperties": false,
          "properties": {
            "contract_id": { "type": "string" },
            "schema_version": { "type": "string" },
            "path_or_uri": { "type": "string" }
          }
        },
        "model_spec_ref": {
          "type": ["object", "null"],
          "additionalProperties": false,
          "properties": {
            "model_id": { "type": "string" },
            "schema_version": { "type": "string" },
            "path_or_uri": { "type": "string" }
          }
        }
      },
      "anyOf": [
        { "properties": { "data_contract_ref": { "not": { "type": "null" } } }, "required": ["data_contract_ref"] },
        { "properties": { "model_spec_ref": { "not": { "type": "null" } } }, "required": ["model_spec_ref"] }
      ]
    },
    "modality_decision": {
      "type": "object",
      "description": "How this run chose among pyspark_notebook / declarative_pipeline / lakeflow_connect. Classifying the rubric_factors is interpretation (the agent's job, per toolkit-conventions.md #5); applying the rubric given those factors is deterministic (scripts/recommend_modality.py) -- confidence/basis here describes the classification step, not the rule application.",
      "additionalProperties": false,
      "required": ["chosen", "rubric_factors", "confidence", "basis"],
      "properties": {
        "chosen": { "type": "string", "enum": ["pyspark_notebook", "declarative_pipeline", "lakeflow_connect"] },
        "rubric_factors": {
          "type": "object",
          "additionalProperties": false,
          "required": ["source_is_managed_connector", "requires_streaming", "transform_complexity", "target_layer", "modality_availability"],
          "properties": {
            "source_is_managed_connector": { "type": "boolean", "description": "True if the source object is of a type Lakeflow Connect has a managed connector for (e.g. Salesforce, SQL Server, ServiceNow, Workday) AND no custom transformation is needed at ingestion time." },
            "requires_streaming": { "type": "boolean" },
            "transform_complexity": { "type": "string", "enum": ["simple_declarative", "complex_procedural"], "description": "simple_declarative: expressible as SELECT/JOIN/aggregate/MERGE with no control flow, external calls, or procedural branching. complex_procedural: needs imperative logic a declarative framework can't express." },
            "target_layer": { "type": "string", "enum": ["bronze", "silver", "gold"] },
            "modality_availability": {
              "type": "object",
              "description": "From toolkit.yaml environment.declarative_pipelines_available / lakeflow_connect_available. pyspark_notebook is always available (the universal fallback).",
              "additionalProperties": false,
              "required": ["pyspark_notebook", "declarative_pipeline", "lakeflow_connect"],
              "properties": {
                "pyspark_notebook": { "type": "boolean", "const": true },
                "declarative_pipeline": { "type": "boolean" },
                "lakeflow_connect": { "type": "boolean" }
              }
            }
          }
        },
        "confidence": { "type": "number", "minimum": 0, "maximum": 1 },
        "basis": { "type": "string" }
      }
    },
    "targets": {
      "type": "array",
      "minItems": 1,
      "items": {
        "type": "object",
        "additionalProperties": false,
        "required": ["table_name", "target_catalog", "target_schema", "load_pattern", "merge_keys", "generated_files", "transform_spec_ref"],
        "properties": {
          "table_name": { "type": "string" },
          "target_catalog": { "type": "string" },
          "target_schema": { "type": "string" },
          "load_pattern": { "type": "string", "enum": ["full_refresh", "incremental_append", "merge_upsert", "streaming_cdc"] },
          "merge_keys": { "type": "array", "items": { "type": "string" }, "description": "Empty array only valid when load_pattern is full_refresh." },
          "generated_files": {
            "type": "array",
            "items": {
              "type": "object",
              "additionalProperties": false,
              "required": ["path", "modality", "purpose"],
              "properties": {
                "path": { "type": "string" },
                "modality": { "type": "string", "enum": ["pyspark_notebook", "declarative_pipeline", "lakeflow_connect"] },
                "purpose": { "type": "string", "enum": ["transform_logic", "pipeline_definition", "job_config", "connector_config", "expectations"] }
              }
            }
          },
          "transform_spec_ref": { "type": "string", "description": "Path to the portable transform spec (source-agnostic SELECT/merge-key definition) this target's code was rendered from -- kept so code can be regenerated deterministically without re-deriving the logic." },
          "tests_carried_forward": {
            "type": "array",
            "items": {
              "type": "object",
              "additionalProperties": false,
              "required": ["source_test", "generated_as"],
              "properties": {
                "source_test": { "type": "string", "description": "e.g. 'uniqueness:order_id,line_number' from the source data-contract." },
                "generated_as": { "type": "string", "description": "e.g. 'DLT expectation: expect_or_drop' or 'not carried forward -- see assumptions'." }
              }
            }
          }
        }
      }
    },
    "mock_data": {
      "type": "object",
      "additionalProperties": false,
      "required": ["generated", "location", "row_counts_by_table"],
      "properties": {
        "generated": { "type": "boolean" },
        "location": { "type": "string" },
        "row_counts_by_table": {
          "type": "object",
          "additionalProperties": { "type": "integer", "minimum": 0 }
        }
      }
    },
    "idempotency_check": {
      "type": "object",
      "description": "Local, mock-data-based evidence that the generated merge/upsert logic is safe to re-run. This is NOT a claim the generated code was ever executed against a real Spark/Databricks target -- see references/idempotency-and-mock-data.md for exactly what is and isn't proven this way.",
      "additionalProperties": false,
      "required": ["performed", "method", "result", "evidence_ref"],
      "properties": {
        "performed": { "type": "boolean" },
        "method": { "type": "string" },
        "result": { "type": "string", "enum": ["match", "mismatch", "not_applicable"] },
        "evidence_ref": { "type": ["string", "null"] }
      }
    },
    "readiness_level": { "type": "string", "enum": ["draft", "validated", "approved_for_deployment", "deployed"] },
    "deployment": {
      "type": ["object", "null"],
      "description": "Null until a human explicitly approves, in-conversation, naming the specific target. data-pipeline itself never sets this to a non-null approved state -- see toolkit-conventions.md #1 and #7.",
      "additionalProperties": false,
      "properties": {
        "approved": { "type": "boolean" },
        "approved_by": { "type": "string" },
        "target_named": { "type": "string", "description": "The specific job/object name the human approval named -- never a blanket approval." },
        "approval_note": { "type": "string" },
        "approved_at": { "type": "string", "format": "date-time" }
      },
      "if": { "type": "object" },
      "then": { "required": ["approved", "approved_by", "target_named"] }
    },
    "assumptions": {
      "type": "array",
      "items": {
        "type": "object",
        "additionalProperties": false,
        "required": ["statement", "basis"],
        "properties": { "statement": { "type": "string" }, "basis": { "type": "string" } }
      }
    }
  }
}
